Title,actor,action,action direction,headline stance,
The Battle Against Critical Race Theory,none / other,none/other,anti-CRT,neutral,
Youd better believe theyre teaching CRT in schools,educational practitioners,threats/extent,defending CRT,anti-CRT,
Opinion | Let Talk About Critical Race Theory Bans in Schools,none / other,policy & legal,anti-CRT,neutral,
Senate passes CRT Bill,political influencers,policy & legal,anti-CRT,neutral,
Tennessee bans teaching of critical race theory in schools,political influencers,policy & legal,anti-CRT,neutral,
Number of teachers pledging to teach Critical Race Theory in Surprise stagnates at two,educational practitioners,protest / speaking out,anti-CRT,neutral,
Nebraska governor backs university anti - CRT resolution amid backlash,political influencers,protest / speaking out,anti-CRT,neutral,
The Push Against Teaching Critical Race Theory in Schools is Growing,none / other,protest / speaking out,anti-CRT,neutral,
Critical Race Theory Mississippi,none / other,none/other,neutral,neutral,
Scholar : The fight against CRT is one of national survival,none / other,threats/extent,anti-CRT,anti-CRT,
No new teachers in Downers Grove sign pledge on Sept . 19 to teach Critical Race Theory,educational practitioners,protest / speaking out,anti-CRT,anti-CRT,
Critical race theory in the schools,none / other,none/other,neutral,neutral,
Concerns About Critical Race Theory At The School Board Meeting,political influencers,threats/extent,anti-CRT,neutral,
Critical Race Theory Investigator Christopher Rufo :  This Is How the Media Lies,none / other,threats/extent,anti-CRT,anti-CRT,
General Milley is clueless on critical race theory,political influencers,threats/extent,defending CRT,defending CRT,
Teachers Unions Push CRT in Schools,educational practitioners,protest / speaking out,defending CRT,neutral,
Department of Education wisely retreats from critical race theory,political influencers,policy & legal,anti-CRT,anti-CRT,
What to look for in a CRT monitor : The ultimate guide for retro gamers,none / other,none/other,neutral,neutral,
Letter : A response to letter about Critical Race Theory,none / other,none/other,neutral,neutral,
LETTERS TO THE EDITOR : Lies about Critical Race Theory,none / other,none/other,neutral,neutral,not sure if the lies are for or against CRT 
Here What You Need To Know About A Texas Bill That Aims To Ban Critical Race Theory,none / other,policy & legal,neutral,neutral,
Freddie Mac CRT Program Reports 2021 Issuance Of Nearly $20B,none / other,none/other,neutral,neutral,irrelevant 
Critical Race Theory Is a Potent Issue in the Virginia Governor Race,political influencers,elections,neutral,neutral,
Critical Race Theory Bill Introduced In Senate,political influencers,policy & legal,neutral,neutral,
Ann Coulter : What Dumber Than CRT ? CNN,political influencers,protest / speaking out,anti-CRT,anti-CRT,felt like an opinion but she is speaking out 
Wisconsin assembly passes bill banning critical race theory in the classroom,political influencers,policy & legal,anti-CRT,neutral,
No new teachers in Glen Ellyn sign pledge on Oct . 19 to teach Critical Race Theory,educational practitioners,threats/extent,anti-CRT,neutral,extent
"WATCH : Parents , Activists Protest CRT at Texas School Board Meeting",impacted actors,protest / speaking out,anti-CRT,neutral,
CRT In the Legislature,none / other,policy & legal,neutral,neutral,
Critical Race Theory not taught in some local school districts,educational practitioners,threats/extent,anti-CRT,neutral,
How a Texas school got caught up the critical race theory fight,educational practitioners,policy & legal,neutral,neutral,doesnt mention whether for or against
COMMENTARY : The truth about CRT,none / other,none/other,neutral,neutral,
Some Schools Pay to Push CRT Curriculum at the Literal Expense of Everything Else,educational practitioners,threats/extent,anti-CRT,anti-CRT,
Ted Cruz questions Ketanji Brown Jackson about  critical race theory,political influencers,none/other,anti-CRT,neutral,similar/ headline stance is different this time- questions vs grilled 
Biden Ed . Dept : Pushing CRT activist handbook was an  error  | Politics News,political influencers,none/other,anti-CRT,anti-CRT,
Nick Reed PODCAST : 07 . 23 – CRT Popping Up In More MO Schools,none / other,threats/extent,defending CRT,neutral,
The Left Assault on  Racist  Math Continues : DeSantis Rejects CRT - Riddled Textbooks,political influencers,threats/extent,anti-CRT,anti-CRT,
Indiana school administrator : Youd better believe we teach CRT -- and lie to parents about it,educational practitioners,threats/extent,defending CRT,anti-CRT,
"Lawmakers : COVID relief funds paid for  equity warriors , CRT lessons in public schools | Latest News",political influencers,threats/extent,defending CRT,anti-CRT,repeat
So What The Deal With Critical Race Theory,none / other,none/other,neutral,neutral,
COMMENTARY : The truth about CRT,none / other,none/other,neutral,neutral,
McAuliffe cant define CRT but calls opponents  racist,political influencers,elections,anti-CRT,anti-CRT,
Bill banning critical race theory in school advances,none / other,policy & legal,anti-CRT,neutral,
"CURRICULUM CONTROVERSY : District responds to claims it will implement CRT , gender identity lessons",political influencers,threats/extent,defending CRT,anti-CRT,
Report sparks debate over bans on critical race theory,none / other,policy & legal,neutral,neutral,"""sparks debate"" seems more neutral"
Letter to the Editor : CRT is racism,none / other,threats/extent,anti-CRT,anti-CRT,
10 Things in Politics : Educators Scramble Over CRT,educational practitioners,protest / speaking out,neutral,neutral,
Local Parents Speak Out Against Critical Race Theory | News Radio 101 . 9 Big WAAX,impacted actors,protest / speaking out,anti-CRT,neutral,
DeSantis hopes to block Critical Race Theory from Florida classrooms,political influencers,policy & legal,anti-CRT,neutral,
Guest commentary : Legislation on critical race theory isnt a good idea,political influencers,policy & legal,defending CRT,defending CRT,
Racist CRT Lessons in Public School Classrooms,,,,,
Black Senators Walk Out As Mississippi Lawmakers Pass A Bill To Ban Critical Race Theory,,,,,
New Report Shatters Media Lie That CRT Isnt Taught In Virginia Schools,,,,,
Kristi Noem Pens Bill Blocking Critical Race Theory in South Dakota Schools,,,,,
Republicans unveil bill to ban federal funding of critical race theory,,,,,
Florida bans  critical race theory  from its classrooms,,,,,
GOP : The Fight Against Critical Race Theory Has Only Just Begun,,,,,
Thomas Gallatin : Backlash Against CRT Is Growing The Patriot Post,,,,,
"CRT : What it is , what to do",,,,,
Critical race theory : The education trap,,,,,
The Controversy Over Critical Race Theory Is Creeping Into Kansas Schools,,,,,
Republicans Move Against Teaching Critical Race Theory in Schools,,,,,
PODCAST : 05 . 22 - Critical Race Theory,,,,,
Stand Up And Demand Accountability : Tulsa Schools Warned For Violating CRT Ban,,,,,
Gov . Youngkin Defends Ending CRT In Virginia School Children Education,,,,,
Banned Florida Math Books : See Examples of CRT in Textbooks – NBC 6 South Florida,,,,,
Joe Biden Wants to Take Critical Race Theory to the Next Level,,,,,
Anti - CRT  school board candidates are winning,,,,,
"Critical race theory : Myths , Marxism and more",,,,,
Mom At Center Of CRT Revelations :  Parents Are Not Domestic Terrorists,,,,,
Critical race theory undermines military effectiveness,,,,,
The Battle Against Critical Race Theory,,,,,
"Masks , critical race theory affecting school board races",,,,,
New e - book aims to help parents  combat  CRT in schools,,,,,
Bill banning critical race theory in Arizona heads to committee,,,,,
Educators Sue Missouri School District for Critical Race Theory Training,,,,,
Critical Race Theory : What Christians Need to Know,,,,,
Parents against critical race theory,,,,,
Let honor Martin Luther King Jr . today by rejecting critical race theory,,,,,
FLORIDA SAYS  NO : DeSantis Unveils  Stop WOKE Act  to Remove CRT from  Schools and Workplaces,,,,,
CRT Boosts Heart Failure Survival in Extended Follow - Up,,,,,
Moms Threatened With Lawsuit For Questioning CRT Curriculum,,,,,
Short Interest in Cross Timbers Royalty Trust ( NYSE : CRT ) Grows By 333 . 3 %,,,,,
Teachers union will defend members on critical race theory,,,,,
Masks And CRT Are Just The Start : It Time To Break Public Schools,,,,,
Idaho House And Senate Pass Bill Banning Critical Race Theory In Schools,,,,,
Georgia Board of Education targets teaching of  critical race theory  | State,,,,,
Oklahoma House OKs ban on teaching critical race theory,,,,,
CRT is dividing Democrats and rallying Republicans,,,,,
Biden Set to Push Critical Race Theory on U . S . Schools,,,,,
What Is Critical Race Theory Anyway ?,,,,,
"Space Force Officer Relieved After Denouncing Marxism , Critical Race Theory in Military",,,,,
Critical race theory discussions surface across county,,,,,
Demonizing Critical Race Theory | History News Network,,,,,
Florida rejects 54 new math textbooks citing critical race theory,,,,,
Tenn . House passes bill to ban funding of schools teaching CRT | Politics,,,,,
"UCLA database reveals well - funded push for critical race theory , argues Cornell law professor",,,,,
Bill Banning Critical Race Theory Fails Introduction in Wyoming,,,,,
"100 % projection : Joy Reid slammed for smearing opponents of CRT as racist , terrified radicals",,,,,
Parents Defending Education fights critical race theory in schools,,,,,